{"$schema":"https://json-schema.org/draft/2020-12/schema","$id":"https://kaveep.dev/dev-agent/schemas/tool-descriptor.schema.json","title":"KAVEEP DEV-AGENT Tool Descriptor","type":"object","required":["toolId","name","version","description","owner","capabilityType","operationType","sideEffectClass","riskClass","inputSchemaRef","outputSchemaRef","requiresPolicyEvaluation","requiresHumanApproval","sandboxRequired","networkRequired","supported","enabled","limitations","tags"],"properties":{"toolId":{"type":"string","pattern":"^[a-z][a-z0-9_.-]*$"},"name":{"type":"string","minLength":1},"version":{"type":"string","pattern":"^[0-9]+\\.[0-9]+\\.[0-9]+$"},"description":{"type":"string","minLength":1},"owner":{"type":"string","const":"KAVEEP-DEV-AGENT"},"capabilityType":{"type":"string","enum":["repository_metadata","file_metadata","file_content","text_search"]},"operationType":{"type":"string","enum":["inspect","read","search"]},"sideEffectClass":{"type":"string","enum":["none","read_only","workspace_write","external_write","destructive"]},"riskClass":{"type":"string","enum":["low","moderate","high","critical"]},"inputSchemaRef":{"type":"string","minLength":1},"outputSchemaRef":{"type":"string","minLength":1},"requiresPolicyEvaluation":{"type":"boolean"},"requiresHumanApproval":{"type":"boolean"},"sandboxRequired":{"type":"boolean"},"networkRequired":{"type":"boolean","const":false},"supported":{"type":"boolean"},"enabled":{"type":"boolean"},"limitations":{"type":"array","items":{"type":"string"}},"tags":{"type":"array","items":{"type":"string"}}},"additionalProperties":false}
