{"toolId":"file.stat","name":"file.stat","version":"1.0.0","description":"Return metadata for one safe file without reading its content.","owner":"KAVEEP-DEV-AGENT","capabilityType":"file_metadata","operationType":"inspect","sideEffectClass":"read_only","riskClass":"low","inputSchemaRef":"schemas/tool-request.schema.json","outputSchemaRef":"schemas/tool-result.schema.json","requiresPolicyEvaluation":false,"requiresHumanApproval":false,"sandboxRequired":false,"networkRequired":false,"supported":true,"enabled":true,"limitations":["Requires an explicit approved root."],"tags":["read-only","metadata"]}
